ID,Category,CategoryName,Verb,Adjective,Korean,Core,Structure,Collocation,Contrast,Example,Tone,Strength,Intentionality,Descriptiveness,Note
C1-01,1,Causation & Influence,ameliorate,ameliorative,"개선하다, 완화하다",나쁜 상태를 덜어 더 낫게 만들다,X ameliorates Y,ameliorate conditions / hardship / the effects,mitigate와 비슷하나 개선 방향이 더 뚜렷,Targeted transfers ameliorated the worst effects of the downturn.,positive,moderate,deliberate,mildly descriptive,
C1-02,1,Causation & Influence,facilitate,facilitative,"용이하게 하다, 촉진하다",과정·행동이 더 쉽게 이루어지게 하다,X facilitates Y,facilitate entry / communication / coordination,galvanize보다 약하고 과정 중심 (촉발이 아니라 용이화),Lower switching costs may facilitate market entry.,positive,moderate,deliberate,mildly descriptive,
C1-03,1,Causation & Influence,galvanize,galvanic,자극하여 행동하게 하다,사람을 강하게 자극해 행동하게 하다,X galvanizes A into action,galvanize voters / public support / opposition,facilitate보다 훨씬 강하고 행동 촉발 중심,The announcement galvanized consumers into collective action.,positive,strong,deliberate,strongly descriptive,
C1-04,1,Causation & Influence,cultivate,cultivating,"육성하다, 조성하다",시간을 들여 길러 내다,X cultivates Y,cultivate trust / relationships / a norm,develop보다 의도적 육성과 시간 투입,The program cultivates trust between agencies and residents.,positive,weak,deliberate,strongly descriptive,
C1-05,1,Causation & Influence,invigorate,invigorating,"활성화하다, 기운 나게 하다",활력을 불어넣어 되살리다,X invigorates Y,invigorate the market / debate / sector,stimulate보다 활력 회복의 뉘앙스,Deregulation briefly invigorated the sector.,positive,moderate,deliberate,mildly descriptive,
C1-06,1,Causation & Influence,bolster,,"강화하다, 지지하다",받쳐 주어 더 튼튼하게 하다,X bolsters Y,bolster confidence / the argument / support,buttress보다 일상적이고 범용,The new evidence bolsters confidence in the estimate.,positive,moderate,deliberate,mildly descriptive,
C1-07,1,Causation & Influence,buttress,,"지지하다, 강화하다",떠받쳐 구조적으로 보강하다,X buttresses Y,buttress a claim / theory / institution,bolster보다 격식적이고 구조적 지지,Additional case studies buttress the central claim.,positive,strong,deliberate,strongly descriptive,
C1-08,1,Causation & Influence,expedite,expeditious,"신속히 처리하다, 촉진하다",절차를 빨리 진행되게 하다,X expedites Y,expedite approval / review / the process,accelerate보다 절차·행정 맥락,The reform expedites approval for low-risk applications.,positive,moderate,deliberate,mildly descriptive,
C1-09,1,Causation & Influence,animate,animating,생기를 불어넣다,생기를 불어넣어 움직이게 하다,X animates Y,animate a debate / movement / concern,invigorate보다 내적 동기 부여,A shared grievance animates the movement.,positive,moderate,deliberate,strongly descriptive,
C1-10,1,Causation & Influence,engender,,"낳다, 야기하다",어떤 상태나 감정을 낳다,X engenders Y,engender trust / resentment / compliance,cause보다 격식적이고 추상적 대상,Opaque procedures engender resentment among applicants.,neutral,moderate,neutral,mildly descriptive,
C1-11,1,Causation & Influence,catalyze,catalytic,촉진하다,반응을 촉진해 빠르게 일으키다,X catalyzes Y,catalyze change / reform / a transition,trigger보다 과정 촉진의 뉘앙스,The crisis catalyzed a decade of institutional reform.,neutral,strong,neutral,strongly descriptive,
C1-12,1,Causation & Influence,propagate,propagative,전파하다,널리 퍼뜨려 번지게 하다,X propagates Y,propagate a shock / norm / error,spread보다 전파 경로를 함축,Financial shocks propagate through interbank exposures.,neutral,moderate,neutral,mildly descriptive,
C1-13,1,Causation & Influence,instantiate,,구체화하다,추상적인 것을 구체 사례로 구현하다,X instantiates Y,instantiate a principle / type / pattern,exemplify보다 형식적·논리적,This case instantiates the general pattern described above.,neutral,moderate,deliberate,mildly descriptive,
C1-14,1,Causation & Influence,accentuate,accentuating,강조하다,특정 부분을 도드라지게 하다,X accentuates Y,accentuate differences / inequality / contrast,amplify보다 대비 부각에 초점,Remote work accentuates existing regional disparities.,neutral,moderate,deliberate,mildly descriptive,
C1-15,1,Causation & Influence,amplify,amplifying,"증폭하다, 강화하다",규모나 강도를 키우다,X amplifies Y,amplify the effect / signal / inequality,accentuate보다 크기 증폭,Social media amplifies the reach of misinformation.,neutral,strong,neutral,strongly descriptive,
C1-16,1,Causation & Influence,consolidate,consolidating,"통합하다, 강화하다",흩어진 것을 하나로 굳혀 다지다,X consolidates Y,consolidate power / gains / control,strengthen보다 통합·공고화,The party consolidated control over regional appointments.,neutral,moderate,deliberate,mildly descriptive,
C1-17,1,Causation & Influence,potentiate,potentiating,증강시키다,잠재된 효과를 더 크게 만들다,X potentiates Y,potentiate an effect / a drug's action,amplify보다 생의학적 전문 용어,Sleep deprivation potentiates the stress response.,neutral,strong,deliberate,strongly descriptive,
C1-18,1,Causation & Influence,activate,activating,활성화하다,작동하기 시작하게 하다,X activates Y,activate a mechanism / pathway / clause,trigger보다 기존 기제의 가동,Breach of the terms activates the penalty clause.,neutral,strong,deliberate,strongly descriptive,
C1-19,1,Causation & Influence,mobilize,mobilizing,동원하다,사람·자원을 동원해 움직이게 하다,X mobilizes Y,mobilize resources / supporters / capital,galvanize보다 조직적 동원,The campaign mobilized volunteers across the region.,neutral,strong,deliberate,mildly descriptive,
C1-20,1,Causation & Influence,actuate,actuating,"작동시키다, 촉발하다",실제로 작동시켜 발동하다,X actuates Y,actuate a mechanism / response,activate보다 기계적·기술적,The sensor actuates the shutoff valve.,neutral,moderate,deliberate,mildly descriptive,
C1-21,1,Causation & Influence,induce,inductive,유발하다,어떤 상태나 반응을 유도해 내다,X induces Y,induce compliance / demand / an effect,cause보다 유도 조건을 함축,Higher fees induce substitution toward informal providers.,neutral,strong,neutral,mildly descriptive,
C1-22,1,Causation & Influence,modulate,modulating,조절하다,정도를 조절해 변화시키다,X modulates Y,modulate the effect / intensity / response,moderate보다 연속적 조절,Institutional context modulates the strength of this effect.,neutral,moderate,deliberate,strongly descriptive,
C1-23,1,Causation & Influence,mediate,mediating,매개하다,사이에서 작용해 이어 주다,X mediates the relationship between A and B,mediate the relationship / effect / a dispute,moderate와 달리 경로를 매개함,Trust mediates the relationship between contact and cooperation.,neutral,moderate,deliberate,strongly descriptive,
C1-24,1,Causation & Influence,regulate,regulative,규제하다,일정 상태로 유지되게 다스리다,X regulates Y,regulate access / prices / behavior,control보다 규칙에 의한 조정,The statute regulates access to the registry.,neutral,moderate,deliberate,mildly descriptive,
C1-25,1,Causation & Influence,condition,conditional,조건짓다,조건을 지워 결과를 좌우하다,X conditions Y,condition the outcome / response / eligibility,determine보다 조건부 영향,Prior exposure conditions how respondents interpret the question.,neutral,moderate,neutral,non-descriptive,
C1-26,1,Causation & Influence,predispose,predisposing,~하게 만들다,~하기 쉬운 상태로 만들다,X predisposes A to B,predispose to risk / failure / compliance,cause와 달리 성향·경향만 부여,Weak oversight predisposes agencies to capture.,neutral,moderate,neutral,mildly descriptive,
C1-27,1,Causation & Influence,prime,priming,준비시키다,미리 준비시켜 반응하게 하다,X primes A to do B,prime respondents / expectations / a response,predispose보다 즉각적·실험적,The vignette primes respondents to think in distributive terms.,neutral,moderate,deliberate,mildly descriptive,
C1-28,1,Causation & Influence,elicit,,(반응을) 이끌어내다,반응이나 정보를 이끌어 내다,X elicits Y,elicit a response / preferences / information,evoke보다 의도적 유도,The survey elicits preferences over hypothetical tradeoffs.,neutral,moderate,deliberate,mildly descriptive,
C1-29,1,Causation & Influence,transduce,transductive,변환하다,형태를 바꾸어 전달하다,X transduces Y into Z,transduce a signal into,transmit과 달리 형태 변환을 포함,Receptors transduce chemical signals into electrical activity.,neutral,strong,neutral,strongly descriptive,
C1-30,1,Causation & Influence,transmit,transmissive,전달하다,그대로 옮겨 전달하다,X transmits Y,transmit a shock / information / risk,propagate보다 단순 전달,Banks transmit monetary policy to the real economy.,neutral,moderate,neutral,mildly descriptive,
C1-31,1,Causation & Influence,cascade,,연쇄작용을 일으키다,연쇄적으로 잇따라 번지게 하다,X cascades through Y,cascade through the system / into failures,propagate보다 연쇄·단계적,Small delays cascade through the supply chain.,neutral,strong,accidental,strongly descriptive,
C1-32,1,Causation & Influence,obviate,obviating,제거하다,필요 자체를 없애 버리다,X obviates Y,obviate the need for / the difficulty,prevent와 달리 불필요하게 만듦,A closed-form solution obviates the need for simulation.,neutral,strong,deliberate,non-descriptive,
C1-33,1,Causation & Influence,attenuate,attenuating,약화시키다,점차 약하게 만들다,X attenuates Y,attenuate the effect / signal / bias,weaken보다 점진적 감쇠,Controlling for tenure attenuates the estimated effect.,neutral,moderate,accidental/neutral/deliberate,strongly descriptive,
C1-34,1,Causation & Influence,truncate,truncating,"잘라내다, 줄이다",끝을 잘라 짧게 줄이다,X truncates Y,truncate the distribution / sample / process,curtail보다 물리적 절단,Top-coding truncates the income distribution.,neutral,moderate,deliberate,mildly descriptive,
C1-35,1,Causation & Influence,curtail,curtailing,축소하다,범위나 규모를 줄여 제한하다,X curtails Y,curtail spending / rights / activity,truncate보다 정책적 축소,Emergency measures curtailed freedom of assembly.,neutral/negative,moderate,deliberate,non-descriptive,
C1-36,1,Causation & Influence,inhibit,inhibiting,억제하다,작용을 억눌러 못 하게 하다,X inhibits Y,inhibit growth / participation / an enzyme,prevent보다 부분적 억제,High compliance costs inhibit entry by small firms.,neutral/negative,moderate,deliberate,mildly descriptive,
C1-37,1,Causation & Influence,compromise,compromising,약화시키다,온전함을 훼손해 약화시키다,X compromises Y,compromise integrity / validity / safety,undermine보다 손상 상태에 초점,Missing data compromises the validity of the comparison.,neutral/negative,moderate,neutral,mildly descriptive,
C1-38,1,Causation & Influence,instigate,instigative,선동하다,좋지 않은 일을 부추겨 일으키다,X instigates Y,instigate a conflict / protest / inquiry,provoke보다 계획적 선동,Local elites instigated the boycott.,negative,strong,deliberate,non-descriptive,
C1-39,1,Causation & Influence,incite,inciting,"선동하다, 야기하다",감정을 자극해 행동을 부추기다,X incites Y,incite violence / unrest / hatred,instigate보다 감정 자극과 즉각성,The broadcast incited unrest in several districts.,negative,strong,deliberate,non-descriptive,
C1-40,1,Causation & Influence,provoke,provocative,도발하다,반응을 불러일으키다,X provokes Y,provoke a backlash / debate / response,incite보다 결과 유발에 초점 (중립도 가능),The proposal provoked an immediate backlash.,negative,strong,deliberate,non-descriptive,
C1-41,1,Causation & Influence,exacerbate,exacerbating,악화시키다,이미 나쁜 것을 더 나쁘게 만들다,X exacerbates Y,exacerbate inequality / tensions / the crisis,aggravate보다 학술문에서 선호됨,Austerity exacerbated regional inequality.,negative,strong,accidental/neutral,mildly descriptive,
C1-42,1,Causation & Influence,aggravate,aggravating,악화시키다,나쁜 상태를 한층 악화시키다,X aggravates Y,aggravate a condition / shortage / injury,"exacerbate와 거의 동의, 다소 일상적",Delays aggravated the existing shortage.,negative,moderate,accidental/neutral,mildly descriptive,
C1-43,1,Causation & Influence,undermine,undermining,약화시키다,기반을 서서히 무너뜨리다,X undermines Y,undermine legitimacy / confidence / an argument,erode보다 의도적 훼손 가능,Selective enforcement undermines the legitimacy of the rule.,negative,moderate,accidental/neutral/deliberate,mildly descriptive,
C1-44,1,Causation & Influence,vitiate,vitiating,손상시키다,가치나 효력을 망가뜨리다,X vitiates Y,vitiate an argument / consent / a contract,undermine보다 격식적·법률적,A material misstatement vitiates the agreement.,negative,strong,deliberate,strongly descriptive,
C1-45,1,Causation & Influence,subvert,subversive,전복시키다,체제를 안에서 뒤엎다,X subverts Y,subvert authority / norms / the process,undermine보다 전복 의도가 명시적,The practice subverts the intent of the statute.,negative,strong,deliberate,strongly descriptive,
C1-46,1,Causation & Influence,thwart,thwarting,좌절시키다,계획이나 시도를 좌절시키다,X thwarts Y,thwart an attempt / plan / reform,prevent보다 능동적 저지,Procedural hurdles thwarted the reform effort.,negative,moderate,deliberate,non-descriptive,
C1-47,1,Causation & Influence,erode,eroding,침식시키다,서서히 깎아 없애다,X erodes Y,erode trust / margins / support,undermine보다 점진적·비의도적,Repeated scandals eroded public trust.,negative,moderate,accidental,mildly descriptive,
C1-48,1,Causation & Influence,occlude,occlusive,"막다, 차단하다",막아서 통하지 못하게 하다,X occludes Y,occlude a pathway / view / the mechanism,obscure보다 물리적 차단,Aggregation occludes the underlying heterogeneity.,negative,strong,neutral,strongly descriptive,
C1-49,1,Causation & Influence,stifle,stifling,"억누르다, 방해하다",숨 막히게 억눌러 못 자라게 하다,X stifles Y,stifle innovation / dissent / debate,inhibit보다 억압적 어감,Excessive licensing stifles innovation.,negative,moderate,deliberate,non-descriptive,
C2-01,2,Change & State Transition,surge,surging,급증하다,갑자기 크게 치솟다,X surges,demand / prices / cases surge,increase보다 급격하고 일시적,Applications surged after the deadline was announced.,positive,strong,accidental,mildly descriptive,
C2-02,2,Change & State Transition,accelerate,accelerating,가속화되다,변화의 속도를 빠르게 하다,X accelerates,accelerate growth / decline / adoption,increase와 달리 속도의 변화 (문맥상 부정도 가능),Cheap credit accelerated household borrowing.,positive,strong,accidental,non-descriptive,
C2-03,2,Change & State Transition,advance,advancing,진전하다,앞으로 나아가 진전되다,X advances,advance rapidly / to a new stage,progress보다 목적 지향적 전진,The technology advanced faster than regulation.,positive,moderate,neutral,mildly descriptive,
C2-04,2,Change & State Transition,augment,augmenting,"증가하다, 확대되다",이미 있는 것에 더해 늘리다,X augments Y,augment income / capacity / the dataset,expand보다 보충·추가,Remittances augment household income.,positive,moderate,neutral,non-descriptive,
C2-05,2,Change & State Transition,intensify,intensifying,"심화되다, 강해지다",정도를 더욱 세게 만들다,X intensifies,intensify competition / pressure / efforts,escalate보다 강도 자체,Competition intensified after deregulation.,positive,moderate,neutral,mildly descriptive,
C2-06,2,Change & State Transition,proliferate,proliferating,"급증하다, 확산되다",빠르게 수가 불어나 퍼지다,X proliferates,proliferate rapidly / across sectors,multiply보다 확산 범위,Certification schemes have proliferated since 2000.,positive,strong,accidental,mildly descriptive,
C2-07,2,Change & State Transition,diversify,diversifying,다양해지다,종류를 여러 갈래로 늘리다,X diversifies Y,diversify holdings / the portfolio / risk,expand와 달리 종류의 다양화,Exporters diversified into new markets.,positive,moderate,neutral,mildly descriptive,
C2-08,2,Change & State Transition,accumulate,accumulating,누적되다,차곡차곡 쌓여 늘어나다,X accumulates,accumulate capital / evidence / debt,grow보다 축적 과정,Evidence has accumulated steadily since the first trial.,positive,weak,accidental,mildly descriptive,
C2-09,2,Change & State Transition,expand,expanding,확장되다,범위나 규모가 넓어지다,X expands,expand coverage / operations / the sample,grow보다 범위 확대,The program expanded to twelve additional districts.,positive,moderate,neutral,non-descriptive,
C2-10,2,Change & State Transition,materialize,materializing,"나타나다, 실현되다",실체를 갖추어 나타나다,X materializes,the risk / benefits / gains materialize,emerge보다 예상된 것의 실현,The anticipated savings never materialized.,positive,weak,accidental,mildly descriptive,
C2-11,2,Change & State Transition,transform,transforming,"변화하다, 변형되다",성질까지 근본적으로 바꾸다,X transforms Y,transform the industry / relationship / landscape,change보다 근본적·질적 전환,Digitization transformed how these records are used.,neutral,strong,neutral,strongly descriptive,
C2-12,2,Change & State Transition,convert,converting,전환되다,형태나 종류를 바꾸어 놓다,X converts A into B,convert data into / assets into cash,transform보다 형식 변환,The procedure converts raw scores into percentiles.,neutral,moderate,neutral,non-descriptive,
C2-13,2,Change & State Transition,transition,transitioning,"전환하다, 이행하다",한 상태에서 다른 상태로 넘어가다,X transitions to Y,transition to a new regime / renewable energy,shift보다 단계적 이행,Several economies are transitioning to renewable generation.,neutral,moderate,neutral,mildly descriptive,
C2-14,2,Change & State Transition,evolve,evolving,"진화하다, 발달하다",점진적으로 발전하며 변해 가다,X evolves,evolve gradually / into / over time,transform보다 점진적·자생적,The norm evolved gradually through repeated practice.,neutral,moderate,accidental,mildly descriptive,
C2-15,2,Change & State Transition,mutate,mutating,변이되다,본질이 변질되어 달라지다,X mutates,mutate into / the strain mutates,evolve보다 돌연적·비정상적,The practice mutated into a form of rent-seeking.,neutral,moderate,accidental,strongly descriptive,
C2-16,2,Change & State Transition,adapt,adapting,적응하다,환경에 맞추어 스스로 바꾸다,X adapts to Y,adapt to changing conditions / constraints,adjust보다 근본적·생존 지향,Firms adapted to the new rules by restructuring contracts.,neutral,moderate,deliberate,mildly descriptive,
C2-17,2,Change & State Transition,reconfigure,reconfiguring,재구성되다,구성 요소를 다시 짜 맞추다,X reconfigures Y,reconfigure the network / relationship / system,reorganize보다 배치 변경,The merger reconfigured supply relationships across the sector.,neutral,moderate,neutral,non-descriptive,
C2-18,2,Change & State Transition,reorganize,reorganizing,재조직되다,조직이나 체계를 다시 짜다,X reorganizes Y,reorganize the department / workflow,restructure보다 일상적 재편,The agency reorganized its regional offices.,neutral,moderate,deliberate,mildly descriptive,
C2-19,2,Change & State Transition,restructure,restructuring,재편되다,근본 구조를 재편하다,X restructures Y,restructure debt / the industry / operations,reorganize보다 근본적·재무적,The firm restructured its debt obligations.,neutral,moderate,deliberate,mildly descriptive,
C2-20,2,Change & State Transition,modify,modifying,수정되다,일부를 바꾸어 고치다,X modifies Y,modify the design / assumption / terms,adjust보다 설계 변경,We modify the standard model to allow for heterogeneity.,neutral,weak,deliberate,non-descriptive,
C2-21,2,Change & State Transition,adjust,adjusting,조정되다,조금씩 손보아 맞추다,X adjusts Y,adjust for inflation / the estimate / expectations,modify보다 미세 조정,All figures are adjusted for inflation.,neutral,weak,deliberate,non-descriptive,
C2-22,2,Change & State Transition,reshape,reshaping,재구성되다,모양이나 성격을 다시 빚다,X reshapes Y,reshape the debate / landscape / expectations,transform보다 형태 재형성,The ruling reshaped the regulatory landscape.,neutral,moderate,deliberate,mildly descriptive,
C2-23,2,Change & State Transition,reorient,reorienting,방향을 재조정하다,방향을 새로 잡다,X reorients Y,reorient policy toward / the field / priorities,redirect보다 지향 자체의 재설정,The discipline reoriented itself toward causal inference.,neutral,moderate,deliberate,mildly descriptive,
C2-24,2,Change & State Transition,morph,morphing,형태가 변하다,형태가 서서히 다른 것으로 변하다,X morphs into Y,morph into a different form / gradually morph,transform보다 비정형적·점진적,The pilot scheme morphed into a permanent program.,neutral,moderate,accidental,strongly descriptive,
C2-25,2,Change & State Transition,normalize,normalizing,정상화되다,표준이나 정상으로 자리잡게 하다,X normalizes Y,normalize a practice / behavior / values,legitimize와 달리 일상화·표준화,Remote work has normalized asynchronous communication.,neutral,weak,neutral,mildly descriptive,
C2-26,2,Change & State Transition,crystallize,crystallizing,명확해지다,흐릿하던 것이 또렷한 형태를 갖추다,X crystallizes,the debate / consensus / idea crystallizes,emerge보다 형태 확정,Opposition crystallized around a single demand.,neutral,weak,accidental,mildly descriptive,
C2-27,2,Change & State Transition,emerge,emerging,"나타나다, 등장하다",없던 것이 새로 나타나다,X emerges,emerge from / a pattern emerges / newly emerging,materialize보다 새로움과 자생성,A clear pattern emerges from the disaggregated data.,neutral,weak,accidental,mildly descriptive,
C2-28,2,Change & State Transition,fragment,fragmenting,"조각나다, 분열되다",여러 조각으로 갈라져 흩어지다,X fragments,the market / coalition / field fragments,split보다 다수 조각화,The coalition fragmented after the election.,neutral,moderate,accidental,strongly descriptive,
C2-29,2,Change & State Transition,fluctuate,fluctuating,변동하다,오르내리며 불안정하게 변하다,X fluctuates,fluctuate sharply / around a mean / seasonally,vary보다 시간적 진동,Prices fluctuated sharply through the quarter.,neutral,moderate,accidental,non-descriptive,
C2-30,2,Change & State Transition,oscillate,oscillating,진동하다,규칙적으로 진동하다,X oscillates between A and B,oscillate between extremes / around a value,fluctuate보다 규칙적 왕복,Policy has oscillated between tightening and relaxation.,neutral,moderate,accidental,non-descriptive,
C2-31,2,Change & State Transition,vary,varying,달라지다,경우에 따라 달라지다,X varies with Y,vary widely / systematically / by region,fluctuate와 달리 시간이 아닌 조건별 차이,Effects vary considerably across institutional settings.,neutral,weak,accidental,non-descriptive,
C2-32,2,Change & State Transition,alternate,alternating,번갈아 일어나다,번갈아 가며 바뀌다,X alternates between A and B,alternate between phases / states,oscillate보다 이산적 교대,The regime alternates between expansion and retrenchment.,neutral,weak,accidental,non-descriptive,
C2-33,2,Change & State Transition,swing,swinging,"흔들리다, 바뀌다",크게 흔들리며 방향이 바뀌다,X swings,swing sharply / back toward / in favor of,fluctuate보다 큰 진폭,Public opinion swung sharply after the disclosure.,neutral,moderate,accidental,mildly descriptive,
C2-34,2,Change & State Transition,decline,declining,"감소하다, 하락하다",점차 줄어들어 낮아지다,X declines,decline steadily / sharply / by half,decrease보다 지속적 하락 (문맥상 긍정 가능),Mortality declined steadily over the period.,negative,moderate,neutral,non-descriptive,
C2-35,2,Change & State Transition,wane,waning,쇠퇴하다,한창때를 지나 차차 약해지다,X wanes,interest / influence / support wanes,decline보다 세력 쇠퇴,Enthusiasm for the reform waned within two years.,negative,weak,accidental,mildly descriptive,
C2-36,2,Change & State Transition,abate,abating,"약해지다, 누그러지다",차차 누그러져 잦아들다,X abates,the crisis / pressure / storm abates,decline보다 격렬함의 진정,Inflationary pressure abated in the second half.,negative,weak,accidental,mildly descriptive,
C2-37,2,Change & State Transition,recede,receding,"물러나다, 줄어들다",서서히 물러나 멀어지다,X recedes,the threat / risk / water recedes,abate보다 후퇴·퇴조,The immediate risk of default receded.,negative,moderate,accidental,mildly descriptive,
