ID,Category,CategoryName,Verb,Adjective,Korean,Core,Structure,Collocation,Contrast,Example,Tone,Strength,Intentionality,Descriptiveness,Note
C4-21,4,Analysis & Interpretation,scrutinize,scrutinizing,정밀하게 조사하다,빈틈없이 엄격하게 뜯어보다,X scrutinizes Y,scrutinize the evidence / claims / methodology,examine보다 훨씬 비판적이고 엄밀,Reviewers scrutinized the identification strategy.,neutral/negative,strong,deliberate,strongly descriptive,
C4-22,4,Analysis & Interpretation,dissect,dissecting,"(구조를) 해부하다, 분석하다",해부하듯 낱낱이 갈라 분석하다,X dissects Y,dissect an argument / the logic / a case,analyze보다 공격적이고 세밀,The response dissects the logic of the original claim.,neutral,strong,deliberate,strongly descriptive,
C4-23,4,Analysis & Interpretation,parse,parsing,구문 분석하다,구성 성분으로 갈라 읽어 내다,X parses Y,parse the data / distinction / language,analyze보다 구조적 분해,We parse the distinction into three separate claims.,neutral,moderate,deliberate,strongly descriptive,
C4-24,4,Analysis & Interpretation,deconstruct,deconstructing,구조를 해체하여 분석하다,구조를 해체하여 전제를 드러내다,X deconstructs Y,deconstruct a narrative / binary / category,dissect보다 이론적·비판적 함의,The essay deconstructs the public/private binary.,neutral/negative,strong,deliberate,strongly descriptive,
C4-25,4,Analysis & Interpretation,trace,tracing,(과정·계보를) 추적하다,경로나 기원을 따라가며 밝히다,X traces Y to Z,trace the origins to / development of / a path,track보다 기원 추적에 초점,The author traces the doctrine to nineteenth-century practice.,neutral,moderate,deliberate,mildly descriptive,
C4-26,4,Analysis & Interpretation,model,modeling,(구조를) 모델링하다,현상을 형식적으로 모형화하다,X models Y,model the process / behavior / relationship,analyze보다 형식화에 초점,We model adoption as a function of peer exposure.,neutral,moderate,deliberate,non-descriptive,
C4-27,4,Analysis & Interpretation,uncover,uncovering,드러내다,숨겨져 있던 것을 찾아내다,X uncovers Y,uncover evidence / a pattern / discrepancies,reveal보다 발굴의 노력을 함축,Archival work uncovered discrepancies in the official record.,neutral,moderate,accidental,mildly descriptive,
C4-28,4,Analysis & Interpretation,reveal,revealing,밝히다,가려져 있던 것을 드러내 보이다,X reveals Y,reveal a pattern / limitation / tension,uncover보다 드러남 자체에 초점,Disaggregation reveals substantial heterogeneity.,neutral,moderate,accidental,mildly descriptive,
C4-29,4,Analysis & Interpretation,explain,explaining,설명하다,왜 그런지 이해되도록 밝히다,X explains Y,explain variation / the gap / why,account for보다 일반적,This mechanism explains much of the observed variation.,neutral,moderate,deliberate,non-descriptive,
C4-30,4,Analysis & Interpretation,account for,accounting for,(원인·이유를) 설명하다,현상의 원인·비중을 설명해 내다,X accounts for Y,account for variance / the difference / anomalies,explain보다 통계적 설명 지분의 뉘앙스,Selection accounts for roughly half of the observed gap.,neutral,moderate,deliberate,non-descriptive,
C4-31,4,Analysis & Interpretation,rationalize,rationalizing,논리적으로 설명하다,사후에 그럴듯한 이유를 붙이다,X rationalizes Y,rationalize a decision / anomaly / behavior,explain과 달리 정당화의 뉘앙스,Respondents rationalized the decision after the fact.,neutral,moderate,deliberate,mildly descriptive,
C4-32,4,Analysis & Interpretation,conceptualize,conceptualizing,개념화하다,경험적 대상을 개념으로 정립하다,X conceptualizes Y as Z,conceptualize trust as / power as,define보다 이론적 구성,We conceptualize trust as an institutional rather than personal property.,neutral,moderate,deliberate,non-descriptive,
C4-33,4,Analysis & Interpretation,theorize,theorizing,이론화하다,이론적으로 설명 체계를 세우다,X theorizes Y,theorize the relationship / mechanism / link,conceptualize보다 설명 체계 구축,Few studies theorize the link between the two.,neutral,moderate,deliberate,non-descriptive,
C4-34,4,Analysis & Interpretation,postulate,postulating,가정하다,검증 전 명제로 내세우다,X postulates Y,postulate an assumption / condition / principle,hypothesize보다 검증보다는 상정에 가까움,The model postulates rational updating by all agents.,neutral,moderate,deliberate,non-descriptive,
C4-35,4,Analysis & Interpretation,hypothesize,hypothesizing,가설을 세우다,검증 가능한 가설로 세우다,X hypothesizes that Y,hypothesize that / a mediating role,postulate보다 경험적 검증 지향,We hypothesize that density moderates this effect.,neutral,moderate,deliberate,non-descriptive,
C4-36,4,Analysis & Interpretation,suggest,suggesting,시사하다,완곡하게 시사하다,X suggests that Y,suggest that / a link / an interpretation,imply보다 화자의 조심스러운 제안,The evidence suggests that timing matters more than scale.,neutral,weak,accidental,non-descriptive,
C4-37,4,Analysis & Interpretation,imply,implying,암시하다,논리적으로 함의하다,X implies Y,imply a tradeoff / that / a constraint,suggest보다 논리적 귀결,The result implies a tradeoff between coverage and accuracy.,neutral,weak,accidental,non-descriptive,
C4-38,4,Analysis & Interpretation,point to,,~을 가리키다,근거로서 어떤 결론을 가리키다,X points to Y,point to a mechanism / an explanation / evidence,indicate보다 구체적 근거 제시,Several findings point to a common institutional source.,neutral,weak,accidental,mildly descriptive,
C4-39,4,Analysis & Interpretation,indicate,indicating,"나타내다, 보여주다",징후로서 나타내 보이다,X indicates Y,indicate a trend / problem / association,point to보다 중립적·기술적,Early results indicate a modest association.,neutral,weak,accidental,non-descriptive,
C4-40,4,Analysis & Interpretation,cast (as),casting,(개념·사안을) 어떤 방식으로 규정하다,어떤 성격의 것으로 규정해 보이게 하다,X casts Y as Z,cast the issue as / doubt on,frame보다 평가적,The review casts the debate as a methodological one.,neutral,moderate,deliberate,strongly descriptive,
C4-41,4,Analysis & Interpretation,portray,portraying,"묘사하다, 제시하다",어떤 모습으로 그려 보이다,X portrays Y as Z,portray the actor as / the period as,represent보다 서술적 묘사,The account portrays the reform as inevitable.,neutral,moderate,deliberate,mildly descriptive,
C4-42,4,Analysis & Interpretation,represent,representing,"나타내다, 표현하다",무엇을 대신하여 나타내다,X represents Y,represent a shift / a class of / interests,portray보다 대표·표상의 뜻,These cases represent a broader class of failures.,neutral,moderate,deliberate,non-descriptive,
C4-43,4,Analysis & Interpretation,derive,deriving,도출하다,근거로부터 이끌어 내다,X derives Y from Z,derive a result / measure / implication from,infer보다 형식적 도출,We derive the estimator from first principles.,neutral,moderate,deliberate,non-descriptive,
C4-44,4,Analysis & Interpretation,extrapolate,extrapolating,"외삽하다, 추론하여 확장하다",알려진 범위 밖으로 추정해 넓히다,X extrapolates Y,extrapolate from the sample / to other settings,generalize보다 수치적 외삽,We should be cautious about extrapolating beyond the observed range.,neutral,moderate,deliberate,non-descriptive,
C4-45,4,Analysis & Interpretation,generalize,generalizing,일반화하다,개별 사례에서 일반 명제를 끌어내다,X generalizes Y,generalize from cases / to a population,extrapolate보다 이론적 일반화,These findings may not generalize to smaller firms.,neutral,moderate,deliberate,non-descriptive,
C4-46,4,Analysis & Interpretation,abstract,abstracting,추상화하다,구체를 걷어내고 추상화하다,X abstracts away from Y,abstract away from detail / context,generalize보다 세부 제거에 초점,The model abstracts away from distributional concerns.,neutral,moderate,deliberate,strongly descriptive,
C4-47,4,Analysis & Interpretation,synthesize,synthesizing,종합하다,여러 갈래를 하나로 엮어 내다,X synthesizes Y,synthesize the literature / findings / evidence,summarize보다 통합적 재구성,The chapter synthesizes findings across three literatures.,neutral,strong,deliberate,non-descriptive,
C4-48,4,Analysis & Interpretation,isolate,isolating,(요소를) 분리하여 규명하다,다른 요인과 떼어 내어 살피다,X isolates Y,isolate the effect / mechanism / contribution,separate보다 인과 식별의 뉘앙스,The design isolates the effect of timing from that of scale.,neutral,moderate,deliberate,non-descriptive,
C4-49,4,Analysis & Interpretation,allude (to),alluding,암시하다,직접 언급 않고 넌지시 가리키다,X alludes to Y,allude to a controversy / prior work,imply보다 언급 회피,The footnote alludes to an ongoing controversy.,neutral,weak,accidental,mildly descriptive,
C4-50,4,Analysis & Interpretation,intimate,intimating,은연중에 암시하다,드러내지 않으면서 은근히 내비치다,X intimates Y,intimate a preference / that / disapproval,allude보다 더 미묘하고 사적,The author intimates disapproval without stating it outright.,neutral,weak,accidental,mildly descriptive,
C5-01,5,Evaluation & Judgment,endorse,endorsing,"승인하다, 지지하다",공개적으로 지지를 표명하다,X endorses Y,endorse a proposal / candidate / view,support보다 공식적 표명,The committee endorsed the revised guidelines.,positive,strong,deliberate,non-descriptive,
C5-02,5,Evaluation & Judgment,legitimize,legitimizing,정당화하다,정당한 것으로 인정받게 만들다,X legitimizes Y,legitimize a practice / regime / claim,justify와 달리 사회적 승인 획득,Repeated use legitimizes what began as an exception.,positive,strong,deliberate,mildly descriptive,
C5-03,5,Evaluation & Judgment,sanction,sanctioning,승인하다,공적으로 허가하거나 제재하다,X sanctions Y,sanction a practice / violation / trade,문맥에 따라 승인/처벌 정반대 의미,The board sanctioned the use of provisional data.,positive,strong,deliberate,non-descriptive,
C5-04,5,Evaluation & Judgment,ratify,ratifying,비준하다,정식 절차로 승인해 확정하다,X ratifies Y,ratify a treaty / agreement / amendment,endorse보다 법적 확정,Parliament ratified the treaty in March.,positive,strong,deliberate,non-descriptive,
C5-05,5,Evaluation & Judgment,uphold,upholding,지지하다,무너지지 않게 지지하고 유지하다,X upholds Y,uphold a ruling / principle / standard,endorse보다 유지·수호,The court upheld the lower ruling.,positive,strong,deliberate,non-descriptive,
C5-06,5,Evaluation & Judgment,justify,justifying,정당화하다,정당함을 근거로 밝히다,X justifies Y,justify a decision / assumption / cost,legitimize와 달리 논거 제시에 초점,The authors justify this restriction on statistical grounds.,positive,moderate,deliberate,mildly descriptive,
C5-07,5,Evaluation & Judgment,warrant,warranting,"정당화하다, 근거를 부여하다",정당성이나 근거를 부여하다,X warrants Y,warrant caution / further study / the conclusion,justify보다 '~할 만하다'의 뜻,These anomalies warrant further investigation.,positive,moderate,deliberate,non-descriptive,
C5-08,5,Evaluation & Judgment,assess,assessing,평가하다,가치나 상태를 판단해 평가하다,X assesses Y,assess the impact / risk / feasibility,evaluate보다 실무적·측정 지향,We assess the impact of the subsidy on take-up.,neutral,strong,deliberate,non-descriptive,
C5-09,5,Evaluation & Judgment,evaluate,evaluating,평가하다,기준에 비추어 값을 매기다,X evaluates Y,evaluate performance / evidence / programs,assess보다 판정 절차를 함축,The study evaluates three competing explanations.,neutral,strong,deliberate,non-descriptive,
C5-10,5,Evaluation & Judgment,appraise,appraising,"평가하다, 감정하다",전문적으로 값어치를 감정하다,X appraises Y,appraise the value / evidence / a property,evaluate보다 전문 감정의 뉘앙스,Independent experts appraised the collection.,neutral,strong,deliberate,mildly descriptive,
C5-11,5,Evaluation & Judgment,critique,critiquing,비평하다,결함을 짚어 비판적으로 논평하다,X critiques Y,critique the methodology / framework / argument,criticize보다 학술적·건설적,The response critiques the identification strategy.,neutral,strong,deliberate,non-descriptive,
C5-12,5,Evaluation & Judgment,review,reviewing,검토하다,전반을 훑어 검토하다,X reviews Y,review the literature / evidence / a decision,critique보다 중립적 개관,Section 2 reviews the relevant literature.,neutral,moderate,deliberate,non-descriptive,
C5-13,5,Evaluation & Judgment,gauge,gauging,판단하다,어림잡아 헤아리다,X gauges Y,gauge sentiment / support / the extent,measure보다 대략적 파악,Surveys gauge public sentiment imperfectly.,neutral,moderate,deliberate,non-descriptive,
C5-14,5,Evaluation & Judgment,measure,measuring,측정·평가하다,수치로 재어 확정하다,X measures Y,measure the effect / distance / inequality,gauge보다 정밀하고 조작적,We measure inequality using the Gini coefficient.,neutral,moderate,deliberate,non-descriptive,
C5-15,5,Evaluation & Judgment,weigh,weighing,따져보다,여러 요소를 견주어 비중을 따지다,X weighs Y against Z,weigh costs against benefits / the evidence,assess보다 형량·비교에 초점,Courts must weigh privacy interests against public safety.,neutral,moderate,deliberate,non-descriptive,
C5-16,5,Evaluation & Judgment,verify,verifying,검증하다,사실인지 확인해 입증하다,X verifies Y,verify a claim / identity / the data,confirm보다 절차적 확인,Auditors verified the reported figures.,neutral,strong,deliberate,non-descriptive,
C5-17,5,Evaluation & Judgment,validate,validating,타당성을 입증하다,타당성을 검증해 인정하다,X validates Y,validate an instrument / model / finding,verify보다 타당도 검증,We validate the scale against an external criterion.,neutral,strong,deliberate,non-descriptive,
C5-18,5,Evaluation & Judgment,confirm,confirming,확인하다,사실임을 뒷받침해 굳히다,X confirms Y,confirm a hypothesis / suspicion / result,verify보다 결과 일치에 초점,Replication confirms the original finding.,neutral,strong,deliberate,non-descriptive,
C5-19,5,Evaluation & Judgment,corroborate,corroborating,확증하다,독립된 증거로 뒷받침하다,X corroborates Y,corroborate an account / finding / testimony,confirm보다 독립 출처의 보강,Interview data corroborate the archival record.,neutral,strong,deliberate,non-descriptive,
C5-20,5,Evaluation & Judgment,authenticate,authenticating,진위를 확인하다,진짜임을 확인해 주다,X authenticates Y,authenticate a document / signature / artifact,verify보다 진위 판정,Experts authenticated the manuscript.,neutral,strong,deliberate,non-descriptive,
C5-21,5,Evaluation & Judgment,substantiate,substantiating,입증하다,증거로 실질을 뒷받침하다,X substantiates Y,substantiate a claim / allegation / hypothesis,corroborate보다 주장 자체의 입증,The report fails to substantiate its central claim.,neutral,strong,deliberate,non-descriptive,
C5-22,5,Evaluation & Judgment,audit,auditing,검증·감사하다,장부·절차를 공식 점검하다,X audits Y,audit accounts / compliance / an algorithm,review보다 공식적·체계적 점검,Regulators audited the firm's compliance procedures.,neutral,moderate,deliberate,non-descriptive,
C5-23,5,Evaluation & Judgment,qualify,qualifying,제한하다,조건을 달아 범위를 제한하다,X qualifies Y,qualify a claim / statement / conclusion,temper보다 단서 부착에 초점,The authors qualify this conclusion in a footnote.,neutral,weak,deliberate,non-descriptive,
C5-24,5,Evaluation & Judgment,temper,tempering,(주장을) 완화하다,지나침을 누그러뜨리다,X tempers Y,temper enthusiasm / a claim / expectations,qualify보다 강도 완화,These caveats temper the paper's stronger claims.,neutral,weak,deliberate,mildly descriptive,
C5-25,5,Evaluation & Judgment,moderate,moderating,조절하다,정도를 알맞게 낮추어 조절하다,X moderates Y,moderate the effect / relationship / tone,mediate와 달리 강도를 조절함,Firm size moderates the effect of regulation on exit.,neutral,weak,deliberate,non-descriptive,
C5-26,5,Evaluation & Judgment,mitigate,mitigating,완화하다,나쁜 영향을 덜어 완화하다,X mitigates Y,mitigate risk / harm / the impact,moderate보다 피해 경감에 초점,Insurance mitigates the impact of income shocks.,neutral,weak,deliberate,mildly descriptive,
C5-27,5,Evaluation & Judgment,emphasize,emphasizing,강조하다,중요성을 힘주어 강조하다,X emphasizes Y,emphasize the limitation / need / role,highlight보다 화자 의지가 강함,The discussion emphasizes the provisional nature of these estimates.,neutral,moderate,deliberate,mildly descriptive,
C5-28,5,Evaluation & Judgment,underscore,underscoring,강조하다,재차 분명히 뒷받침해 강조하다,X underscores Y,underscore the importance / risk / point,emphasize보다 확증적,These results underscore the value of disaggregation.,neutral,moderate,deliberate,mildly descriptive,
C5-29,5,Evaluation & Judgment,highlight,highlighting,부각하다,눈에 띄게 드러내 보이다,X highlights Y,highlight a discrepancy / strength / gap,emphasize보다 가시화,The table highlights discrepancies between the two sources.,neutral,moderate,deliberate,mildly descriptive,
C5-30,5,Evaluation & Judgment,characterize,characterizing,특징짓다,특징을 규정해 서술하다,X characterizes Y as Z,characterize the period as / the relationship as,describe보다 성격 규정,The author characterizes the era as one of managed decline.,neutral,moderate,deliberate,mildly descriptive,
C5-31,5,Evaluation & Judgment,deem,deeming,~로 간주하다,~라고 여기어 판단하다,X deems Y Z,deem it necessary / inadmissible / appropriate,consider보다 공식적 판정,The court deemed the evidence inadmissible.,neutral,moderate,deliberate,non-descriptive,
C5-32,5,Evaluation & Judgment,conclude,concluding,결론짓다,검토 끝에 결론을 내리다,X concludes that Y,conclude that / from the evidence,determine보다 논증의 귀결,We conclude that the effect is concentrated among new entrants.,neutral,moderate,deliberate,non-descriptive,
C5-33,5,Evaluation & Judgment,determine,determining,판단하다,조사해 확정하다,X determines Y,determine eligibility / the cause / whether,conclude보다 사실 확정,The inquiry determined the cause of the failure.,neutral,strong,deliberate,non-descriptive,
C5-34,5,Evaluation & Judgment,challenge,challenging,"문제 삼다, 이의를 제기하다",타당성에 이의를 제기하다,X challenges Y,challenge an assumption / finding / authority,dispute보다 근본적 문제 제기,These data challenge the standard interpretation.,neutral,moderate,deliberate,non-descriptive,
C5-35,5,Evaluation & Judgment,dismiss,dismissing,일축하다,고려할 가치 없다고 물리치다,X dismisses Y,dismiss a concern / claim / objection,reject보다 경시하는 태도,The reply dismisses these objections too quickly.,negative,moderate,deliberate,mildly descriptive,
C5-36,5,Evaluation & Judgment,reject,rejecting,거부하다,받아들이지 않고 물리치다,X rejects Y,reject a hypothesis / proposal / claim,dismiss보다 판단에 근거한 거부,We reject the null at conventional levels.,negative,strong,deliberate,non-descriptive,
C5-37,5,Evaluation & Judgment,dispute,disputing,이의를 제기하다,옳지 않다며 다투다,X disputes Y,dispute the finding / interpretation / figures,challenge보다 사실 자체를 다툼,Several authors dispute these figures.,neutral,moderate,deliberate,non-descriptive,
C5-38,5,Evaluation & Judgment,contest,contesting,"다투다, 이의를 제기하다",이의를 제기하며 겨루다,X contests Y,contest a claim / result / election,dispute보다 적극적 경합,Rival groups contest the meaning of the term.,neutral,strong,deliberate,non-descriptive,
C5-39,5,Evaluation & Judgment,refute,refuting,반박하다,근거를 들어 그르다고 반박하다,X refutes Y,refute a claim / hypothesis / argument,rebut보다 결정적 논파,The experiment refutes the strong version of the hypothesis.,negative,strong,deliberate,non-descriptive,
C5-40,5,Evaluation & Judgment,rebut,rebutting,반박하다,상대 주장에 맞받아 반론하다,X rebuts Y,rebut a criticism / charge / argument,refute와 달리 논파 성공을 함축하지 않음,The authors rebut each of these criticisms in turn.,negative,strong,deliberate,non-descriptive,
C5-41,5,Evaluation & Judgment,repudiate,repudiating,"부인하다, 거부하다",전면적으로 부인하고 관계를 끊다,X repudiates Y,repudiate a doctrine / debt / claim,reject보다 공개적·전면적 부인,The government repudiated the earlier agreement.,negative,strong,deliberate,non-descriptive,
C5-42,5,Evaluation & Judgment,discredit,discrediting,신뢰를 떨어뜨리다,신뢰를 잃게 만들다,X discredits Y,discredit a theory / witness / source,undermine보다 신뢰성 자체를 겨냥,Subsequent work discredited the original measure.,negative,strong,deliberate,non-descriptive,
C5-43,5,Evaluation & Judgment,invalidate,invalidating,무효화하다,효력이나 타당성을 무효로 만들다,X invalidates Y,invalidate a result / license / assumption,discredit보다 논리적·법적 무효,Measurement error does not invalidate the broader conclusion.,negative,strong,deliberate,non-descriptive,
C5-44,5,Evaluation & Judgment,nullify,nullifying,무효화하다,법적으로 무효화하여 없애다,X nullifies Y,nullify a contract / provision / effect,invalidate보다 법적 효력 소멸,The ruling nullified the disputed provision.,negative,strong,deliberate,non-descriptive,
C5-45,5,Evaluation & Judgment,undermine,undermining,약화시키다,기반을 서서히 무너뜨리다,X undermines Y,undermine credibility / a conclusion / trust,discredit보다 점진적·간접적,Inconsistent reporting undermines the paper's credibility.,negative,moderate,deliberate,mildly descriptive,
C5-46,5,Evaluation & Judgment,marginalize,marginalizing,"소외시키다, 중요성 축소",주변으로 밀어내 영향력을 없애다,X marginalizes Y,marginalize a group / perspective / voice,dismiss보다 구조적 배제,Standard measures marginalize informal labor.,negative,moderate,deliberate,mildly descriptive,
C5-47,5,Evaluation & Judgment,devalue,devaluing,가치·중요성을 떨어뜨리다,가치를 낮잡아 떨어뜨리다,X devalues Y,devalue expertise / labor / a credential,discount보다 가치 절하 자체,Credential inflation devalues the degree.,negative,moderate,deliberate,mildly descriptive,
C5-48,5,Evaluation & Judgment,discount,discounting,평가절하하다,대수롭지 않게 깎아 보다,X discounts Y,discount evidence / testimony / a risk,dismiss보다 부분적 경시,Reviewers discounted the self-reported measures.,negative,moderate,deliberate,mildly descriptive,
C5-49,5,Evaluation & Judgment,mischaracterize,mischaracterizing,부정확하게 묘사하다,성격을 잘못 규정해 왜곡하다,X mischaracterizes Y,mischaracterize a position / finding / debate,"misrepresent와 유사, 성격 규정 오류",The summary mischaracterizes the original argument.,negative,strong,deliberate,mildly descriptive,
C6-01,6,Classification & Definition Verbs,classify,classifying,분류하다,기준에 따라 갈래로 나누어 묶다,X classifies Y as Z,classify cases as / into categories,categorize보다 체계적 기준을 함축,We classify these regimes as hybrid rather than authoritarian.,neutral,moderate,deliberate,non-descriptive,
C6-02,6,Classification & Definition Verbs,categorize,categorizing,범주화하다,범주에 넣어 정리하다,X categorizes Y,categorize responses / items / firms,classify보다 일상적이고 느슨함,Responses were categorized by theme.,neutral,moderate,deliberate,non-descriptive,
C6-03,6,Classification & Definition Verbs,codify,codifying,"체계화하다, 법칙화하다",규칙을 성문화해 정리하다,X codifies Y,codify a practice / norm / rule,formalize보다 문서화·법제화,The statute codifies what had been informal practice.,neutral,strong,deliberate,non-descriptive,
C6-04,6,Classification & Definition Verbs,systematize,systematizing,체계적으로 정리하다,흩어진 것을 체계로 세우다,X systematizes Y,systematize knowledge / procedures / findings,organize보다 체계 구축,The handbook systematizes decades of scattered findings.,neutral,strong,deliberate,non-descriptive,
C6-05,6,Classification & Definition Verbs,typify,typifying,전형화하다,전형적인 예로 대표하다,X typifies Y,typify a pattern / an era / the approach,"exemplify와 유사, 전형성 강조",This case typifies the problems of delegated enforcement.,neutral,moderate,deliberate,mildly descriptive,
C6-06,6,Classification & Definition Verbs,typologize,typologizing,유형화하다,유형론으로 분류 체계를 세우다,X typologizes Y,typologize regimes / cases / strategies,classify보다 이론적 유형화,The chapter typologizes welfare regimes along two dimensions.,neutral,strong,deliberate,non-descriptive,
