ID,Category,CategoryName,Verb,Adjective,Korean,Core,Structure,Collocation,Contrast,Example,Tone,Strength,Intentionality,Descriptiveness,Note
C2-38,2,Change & State Transition,plummet,plummeting,급락하다,갑자기 곤두박질치다,X plummets,prices / numbers / confidence plummet,decline보다 급격하고 극적,Enrollment plummeted after the fee increase.,negative,strong,accidental,strongly descriptive,
C2-39,2,Change & State Transition,contract,contracting,축소되다,규모가 줄어 오그라들다,X contracts,the economy / market / sector contracts,shrink보다 경제학 용어로 관용적,The economy contracted for two consecutive quarters.,negative,moderate,neutral,non-descriptive,
C2-40,2,Change & State Transition,shrink,shrinking,줄어들다,크기나 양이 작아지다,X shrinks,the gap / share / margin shrinks,contract보다 일상적,The gender gap in enrollment has shrunk considerably.,negative,moderate,accidental,non-descriptive,
C2-41,2,Change & State Transition,wither,withering,"시들다, 약해지다",생기를 잃고 시들어 가다,X withers,support / the movement / industry withers,decline보다 소멸에 가까운 쇠퇴,Local manufacturing withered under import competition.,negative,moderate,accidental,strongly descriptive,
C2-42,2,Change & State Transition,dwindle,dwindling,감소하다,조금씩 줄어 사라져 가다,X dwindles,resources / numbers / reserves dwindle,shrink보다 고갈 방향,Reserves dwindled to a fraction of their former level.,negative,moderate,accidental,mildly descriptive,
C2-43,2,Change & State Transition,deteriorate,deteriorating,악화되다,상태가 나빠지다,X deteriorates,conditions / quality / relations deteriorate,decline보다 질적 악화,Working conditions deteriorated after the restructuring.,negative,strong,accidental,non-descriptive,
C2-44,2,Change & State Transition,dilute,diluting,희석되다,섞어서 농도나 강도를 묽게 하다,X dilutes Y,dilute the effect / ownership / a standard,weaken보다 희석의 뉘앙스,Successive amendments diluted the original standard.,negative,weak,neutral,mildly descriptive,
C2-45,2,Change & State Transition,devolve,devolving,"악화되다, 퇴보하다",더 낮은 단계로 퇴보하다,X devolves into Y,devolve into chaos / a formality,deteriorate보다 퇴화·이양 (권한 이양의 뜻도 있음),The consultation devolved into a formality.,negative,moderate,accidental,non-descriptive,
C2-46,2,Change & State Transition,stagnate,stagnating,정체되다,나아가지 못하고 정체되다,X stagnates,wages / growth / the field stagnates,decline과 달리 하락이 아닌 멈춤,Real wages stagnated for over a decade.,negative,moderate,accidental,mildly descriptive,
C2-47,2,Change & State Transition,dissipate,dissipating,소멸되다,흩어져 차츰 사라지다,X dissipates,the effect / energy / tension dissipates,fade보다 분산 소멸,The initial effect dissipates within three months.,negative,weak,accidental,mildly descriptive,
C2-48,2,Change & State Transition,escalate,escalating,"악화되다, 심화되다",단계적으로 더 심해지다,X escalates,escalate into / tensions / costs escalate,intensify보다 단계적 상승과 통제 곤란,A minor dispute escalated into a legal battle.,negative,strong,neutral,mildly descriptive,
C2-49,2,Change & State Transition,taper,tapering,점차 줄어들다,점점 가늘어져 줄어들다,X tapers off,support / growth / the effect tapers off,decline보다 완만한 감소,Growth tapered off toward the end of the period.,negative,weak,accidental,mildly descriptive,
C2-50,2,Change & State Transition,disperse,dispersing,"흩어지다, 분산되다",여기저기로 흩어지게 하다,X disperses,disperse a crowd / risk / population,dissipate와 달리 공간적 분산,The policy disperses risk across a wider pool.,neutral,weak,accidental,mildly descriptive,
C3-01,3,Comparison & Relation,harmonize,harmonizing,조화를 이루다,서로 어울리게 맞추어 조화시키다,X harmonizes Y,harmonize standards / rules / accounts,align보다 상충 제거와 조화,The directive harmonizes reporting standards across member states.,positive,moderate,deliberate,mildly descriptive,
C3-02,3,Comparison & Relation,reconcile,reconciling,"조화시키다, 일치시키다",상충하는 것을 조정해 양립시키다,X reconciles A with B,reconcile findings with / competing accounts,harmonize보다 모순 해소에 초점,The paper reconciles these findings with earlier evidence.,positive,moderate,deliberate,mildly descriptive,
C3-03,3,Comparison & Relation,align,aligning,"정렬되다, 조화되다",방향이나 기준을 일치시키다,X aligns A with B,align incentives with / practice with policy,harmonize보다 방향 일치,The scheme aligns managerial incentives with long-run value.,positive,moderate,deliberate,non-descriptive,
C3-04,3,Comparison & Relation,coordinate,coordinating,"조화하다, 조정하다",여러 요소가 맞물려 움직이게 하다,X coordinates Y,coordinate efforts / responses / policy,align보다 실행 조율,Agencies failed to coordinate their responses.,positive,moderate,deliberate,non-descriptive,
C3-05,3,Comparison & Relation,cohere,coherent,"밀접하게 연결되다, 일관성을 갖다",논리적으로 앞뒤가 들어맞다,X coheres with Y,cohere with the evidence / theory,align보다 내적 정합성,This interpretation coheres with the broader literature.,positive,moderate,accidental,mildly descriptive,
C3-06,3,Comparison & Relation,resonate (with),resonating,공명하다,깊이 공감하며 반향을 일으키다,X resonates with Y,resonate with audiences / experience / concerns,appeal to보다 정서적 반향,The framing resonates with voters' lived experience.,positive,weak,accidental,strongly descriptive,
C3-07,3,Comparison & Relation,adhere (to),adhering,"~에 부합하다, 준수하다",기준이나 원칙에 부합하다,X adheres to Y,adhere to a standard / protocol / principle,comply with보다 자발적 준수,The study adheres to preregistration guidelines.,positive,weak,deliberate,non-descriptive,
C3-08,3,Comparison & Relation,approximate,approximating,"유사하다, 근사하다",가깝게 어림하여 비슷해지다,X approximates Y,approximate the true value / a normal distribution,resemble보다 수량적 근사,The sample approximates the national distribution.,positive,weak,accidental,non-descriptive,
C3-09,3,Comparison & Relation,resemble,resembling,"닮다, 유사하다",겉모습이나 성질이 비슷하다,X resembles Y,closely resemble / superficially resemble,approximate와 달리 질적 유사,The pattern resembles that observed in earlier crises.,neutral,weak,accidental,non-descriptive,
C3-10,3,Comparison & Relation,mirror,mirroring,"반영하다, 닮다",그대로 비추듯 똑같이 나타내다,X mirrors Y,mirror the trend / structure / findings,resemble보다 대응이 정확함,Regional trends mirror the national pattern.,neutral,weak,accidental,mildly descriptive,
C3-11,3,Comparison & Relation,echo,echoing,(특징·패턴을) 반영하다,특징이나 패턴을 되풀이해 보여 주다,X echoes Y,echo earlier findings / a concern / language,mirror보다 부분적 반향,These results echo findings from the 1990s.,neutral,weak,accidental,mildly descriptive,
C3-12,3,Comparison & Relation,parallel,paralleling,"유사하다, 평행하다",나란히 같은 양상으로 가다,X parallels Y,parallel the development / trajectory / case,mirror보다 병행 진행,The Korean case parallels the Taiwanese experience.,neutral,moderate,accidental,mildly descriptive,
C3-13,3,Comparison & Relation,correspond,corresponding,"일치하다, 부합하다",서로 대응하여 들어맞다,X corresponds to Y,correspond to a category / value / period,match보다 대응 관계,Each code corresponds to a distinct funding stream.,neutral,moderate,neutral,non-descriptive,
C3-14,3,Comparison & Relation,match,matching,"부합하다, 일치하다",정확히 맞아떨어지다,X matches Y,match the prediction / record / criteria,correspond보다 일치의 정도가 강함,Observed shares match the model's predictions closely.,neutral,weak,accidental,non-descriptive,
C3-15,3,Comparison & Relation,simulate,simulating,"흉내 내다, 유사 양상을 보이다",실제처럼 흉내 내어 재현하다,X simulates Y,simulate the process / outcomes / a market,replicate와 달리 모형적 재현,We simulate outcomes under alternative assumptions.,neutral,moderate,deliberate,strongly descriptive,
C3-16,3,Comparison & Relation,replicate,replicating,"재현하다, 유사하게 나타나다",같은 조건으로 다시 해 재현하다,X replicates Y,replicate a study / result / design,simulate와 달리 실증적 반복,Three teams failed to replicate the original result.,neutral,moderate,deliberate,strongly descriptive,
C3-17,3,Comparison & Relation,reflect,reflecting,반영하다 (관계·유사성),어떤 성질을 그대로 드러내 보이다,X reflects Y,reflect underlying values / a shift / bias,mirror보다 원인 반영의 뉘앙스,These disparities reflect differences in initial endowments.,neutral,moderate,accidental,mildly descriptive,
C3-18,3,Comparison & Relation,differ,differing,다르다,서로 다르다,X differs from Y,differ markedly / systematically from,diverge와 달리 상태의 차이,The two measures differ in how they treat part-time work.,neutral,weak,accidental,non-descriptive,
C3-19,3,Comparison & Relation,diverge,diverging,갈라지다,갈라져 점점 벌어지다,X diverges from Y,diverge from the trend / prediction / path,differ와 달리 시간에 따른 이탈,After 1990 the two series diverge sharply.,neutral,moderate,accidental,mildly descriptive,
C3-20,3,Comparison & Relation,deviate,deviating,벗어나다,정상 경로에서 벗어나다,X deviates from Y,deviate from the norm / protocol / mean,diverge보다 기준 이탈,Several sites deviated from the assigned protocol.,neutral,moderate,accidental,mildly descriptive,
C3-21,3,Comparison & Relation,contrast,contrasting,대비되다,맞대어 차이를 드러내다,X contrasts A with B,contrast sharply with / two approaches,compare와 달리 차이 강조,This finding contrasts sharply with earlier work.,neutral,moderate,deliberate,strongly descriptive,
C3-22,3,Comparison & Relation,oppose,opposing,대립되다,맞서서 반대 입장에 서다,X opposes Y,oppose a measure / view / interpretation,contrast보다 대립 행위,Local governments opposed the consolidation plan.,neutral,moderate,deliberate,non-descriptive,
C3-23,3,Comparison & Relation,counterpose,counterposing,대조시키다,서로 맞세워 대비시키다,X counterposes A to B,counterpose one model to another,contrast보다 의도적 대치 배치,The essay counterposes market logic to civic obligation.,neutral,strong,deliberate,strongly descriptive,
C3-24,3,Comparison & Relation,contradict,contradicting,모순되다,서로 양립할 수 없이 어긋나다,X contradicts Y,contradict the evidence / earlier claims,differ와 달리 양립 불가,These results directly contradict the standard model.,neutral,moderate,accidental,non-descriptive,
C3-25,3,Comparison & Relation,juxtapose,juxtaposing,병치하여 비교하다,나란히 놓아 대비 효과를 내다,X juxtaposes A and B,juxtapose two cases / images / accounts,contrast보다 배치 자체,The chapter juxtaposes rural and urban trajectories.,neutral,strong,deliberate,strongly descriptive,
C3-26,3,Comparison & Relation,situate,situating,"배치하다, 위치시키다",특정 맥락에 자리잡게 하다,X situates Y within Z,situate the case within / in relation to,locate보다 관계 설정,We situate this case within the comparative literature.,neutral,weak,deliberate,mildly descriptive,
C3-27,3,Comparison & Relation,contextualize,contextualizing,맥락화하다,배경을 부여해 이해되게 하다,X contextualizes Y,contextualize the comparison / difference,situate보다 배경 설명,The chapter contextualizes these differences historically.,neutral,moderate,deliberate,strongly descriptive,
C3-28,3,Comparison & Relation,frame,framing,"틀짓다, 관점에서 규정하다",특정 관점으로 규정해 제시하다,X frames Y as Z,frame the comparison as / the difference as,situate보다 관점 부여,"The report frames the gap as a matter of access, not ability.",neutral,moderate,deliberate,mildly descriptive,
C3-29,3,Comparison & Relation,position,positioning,"위치시키다, 자리매김하다",특정 위치나 입장에 놓다,X positions Y as Z,position the case as / itself relative to,situate보다 전략적,The authors position their approach between the two camps.,neutral,moderate,deliberate,non-descriptive,
C3-30,3,Comparison & Relation,map,mapping,(구조·관계를) 도식화하다,구조나 관계를 도식화해 보이다,X maps Y onto Z,map concepts onto / the relationship / a typology,chart보다 대응 관계 작성,We map these practices onto three ideal types.,neutral,moderate,deliberate,strongly descriptive,
C3-31,3,Comparison & Relation,anchor,anchoring,"고정시키다, 위치를 확립하다",기준점에 붙들어 고정하다,X anchors Y in Z,anchor the analysis in / expectations / claims,ground보다 고정점 강조,The argument is anchored in three detailed case studies.,neutral,moderate,deliberate,mildly descriptive,
C3-32,3,Comparison & Relation,embed,embedding,내재시키다,더 큰 구조 안에 박아 넣다,X embeds Y in Z,embed the analysis in / practices in context,situate보다 내재화 정도가 강함,Economic action is embedded in social relations.,neutral,moderate,accidental,mildly descriptive,
C3-33,3,Comparison & Relation,locate,locating,위치를 정하다,특정 지점에 자리매김하다,X locates Y in Z,locate the difference in / the source in,situate보다 지점 특정,We locate the source of the divergence in early schooling.,neutral,weak,deliberate,non-descriptive,
C3-34,3,Comparison & Relation,correlate,correlating,상관관계가 있다,두 변수가 함께 변하다,X correlates with Y,correlate strongly / positively / weakly with,cause와 달리 인과 없음,Income correlates strongly with turnout.,neutral,moderate,accidental,non-descriptive,
C3-35,3,Comparison & Relation,converge,converging,"수렴하다, 비슷해지다",여러 갈래가 한 점으로 모이다,X converges on Y,converge on a consensus / value / explanation,align보다 수렴 과정,Independent studies converge on a similar estimate.,neutral,moderate,accidental,mildly descriptive,
C3-36,3,Comparison & Relation,counterbalance,counterbalancing,균형을 이루다,반대 방향으로 작용해 상쇄시키다,X counterbalances Y,counterbalance a risk / bias / tendency,offset보다 균형 회복,Judicial review counterbalances executive discretion.,neutral,moderate,deliberate,mildly descriptive,
C3-37,3,Comparison & Relation,equate,equating,동일시하다,같은 것으로 취급하다,X equates A with B,equate growth with welfare / size with power,compare와 달리 동일시 (종종 비판적),Critics warn against equating growth with welfare.,neutral,moderate,deliberate,non-descriptive,
C3-38,3,Comparison & Relation,outstrip,outstripping,능가하다,앞질러 능가하다,X outstrips Y,outstrip supply / demand / capacity,exceed보다 격차 확대의 동적 뉘앙스,Demand has outstripped available capacity.,neutral,strong,accidental,non-descriptive,
C3-39,3,Comparison & Relation,exceed,exceeding,초과하다,정해진 수준을 넘어서다,X exceeds Y,exceed the threshold / expectations / limits,outstrip보다 기준 초과에 초점,Concentrations exceeded the regulatory threshold.,neutral,moderate,accidental,non-descriptive,
C3-40,3,Comparison & Relation,surpass,surpassing,능가하다,능가하여 앞서다,X surpasses Y,surpass previous levels / rivals / a record,exceed보다 경쟁적 우월,Output surpassed pre-crisis levels in 2023.,neutral,moderate,accidental,non-descriptive,
C3-41,3,Comparison & Relation,outweigh,outweighing,"~보다 크다, 더 중요하다",비중이나 중요성에서 앞서다,X outweighs Y,benefits outweigh costs / risks,exceed와 달리 가치 형량,The long-run benefits outweigh the transition costs.,neutral,moderate,accidental,non-descriptive,
C3-42,3,Comparison & Relation,eclipse,eclipsing,"가리다, 능가하다",압도하여 빛을 잃게 하다,X eclipses Y,eclipse earlier work / a rival / the debate,surpass보다 상대를 가림,The later study eclipsed the original finding.,neutral,strong,accidental,strongly descriptive,
C3-43,3,Comparison & Relation,overshadow,overshadowing,"가리다, 압도하다",가려서 덜 주목받게 하다,X overshadows Y,overshadow the findings / other factors,eclipse보다 주목 분산,Methodological disputes overshadowed the substantive result.,neutral,strong,accidental,strongly descriptive,
C3-44,3,Comparison & Relation,fall short,,모자라다,기준에 못 미치다,X falls short of Y,fall short of expectations / the target / proof,fail보다 미달 정도,The evidence falls short of establishing causation.,neutral,weak,accidental,non-descriptive,
C3-45,3,Comparison & Relation,lag behind,lagging,뒤처지다,남들보다 뒤처지다,X lags behind Y,lag behind peers / the average / reform,fall short보다 시간적 지체,Rural districts lag behind urban ones in coverage.,neutral,moderate,accidental,non-descriptive,
C3-46,3,Comparison & Relation,predominate,predominating,"우세하다, 두드러지다",수적·세력적으로 우세하다,X predominates,predominate in the sample / among cases,dominate보다 분포적 우세,Informal arrangements predominate in the sector.,neutral,moderate,accidental,mildly descriptive,
C3-47,3,Comparison & Relation,distinguish,distinguishing,구별하다,차이를 알아보고 구별하다,X distinguishes A from B,distinguish between / clearly distinguish,differentiate보다 인식적 구별,We distinguish capacity from willingness.,neutral,moderate,deliberate,non-descriptive,
C3-48,3,Comparison & Relation,differentiate,differentiating,"구별하다, 차별화하다",구별되게 다르게 취급하다,X differentiates A from B,differentiate products / cases / treatment,distinguish보다 차별화 행위,Firms differentiate their products to soften competition.,neutral,moderate,deliberate,mildly descriptive,
C3-49,3,Comparison & Relation,demarcate,demarcating,경계 짓다,경계를 그어 나누다,X demarcates Y,demarcate boundaries / the scope / jurisdictions,distinguish보다 경계선 설정,The statute demarcates federal and state jurisdiction.,neutral,moderate,deliberate,mildly descriptive,
C3-50,3,Comparison & Relation,bifurcate,bifurcating,두 갈래로 나뉘다,둘로 갈라지게 하다,X bifurcates,bifurcate into two / the market bifurcates,split보다 두 갈래 분기 명시,The labor market has bifurcated into high- and low-wage segments.,neutral,moderate,accidental,strongly descriptive,
C3-51,3,Comparison & Relation,discriminate,discriminating,구별하다 (비차별 의미),차이를 근거로 가려내다,X discriminates between A and B,discriminate between hypotheses / cases,distinguish보다 판별력 (또는 차별의 뜻),The test discriminates poorly between the two models.,neutral,moderate,deliberate,non-descriptive,
C4-01,4,Analysis & Interpretation,elucidate,elucidating,명확히 밝히다,어려운 것을 밝혀 이해되게 하다,X elucidates Y,elucidate the mechanism / relationship / process,clarify보다 학술적이고 심층적,This experiment elucidates the mechanism linking stress and recall.,positive,moderate,deliberate,strongly descriptive,
C4-02,4,Analysis & Interpretation,explicate,explicating,(개념·의미를) 자세히 설명하다,개념·의미를 조목조목 풀어 설명하다,X explicates Y,explicate a concept / text / argument,elucidate보다 텍스트 해설에 가까움,The paper explicates Rawls's notion of reflective equilibrium.,positive,strong,deliberate,strongly descriptive,
C4-03,4,Analysis & Interpretation,clarify,clarifying,명확히 하다,모호한 것을 분명하게 정리하다,X clarifies Y,clarify the distinction / terms / role,elucidate보다 일상적이고 범위가 좁음,We clarify the distinction between capacity and willingness.,positive,moderate,deliberate,mildly descriptive,
C4-04,4,Analysis & Interpretation,illuminate,illuminating,"밝히다, 해명하다",어두운 부분을 환하게 밝혀 주다,X illuminates Y,illuminate the process / dynamics / question,elucidate보다 은유적·인상적,Comparative cases illuminate the dynamics of policy diffusion.,positive,moderate,deliberate,strongly descriptive,
C4-05,4,Analysis & Interpretation,articulate,articulating,명료하게 표현하다,흐릿한 것을 또렷하게 표현해 내다,X articulates Y,articulate a distinction / rationale / criterion,clarify보다 언어적 정교화,The framework articulates three criteria for inclusion.,positive,moderate,deliberate,non-descriptive,
C4-06,4,Analysis & Interpretation,unravel,unraveling,"(복잡한 내용을) 풀다, 해명하다",얽힌 것을 하나씩 풀어내다,X unravels Y,unravel the complexity / a puzzle / the causal chain,unpack보다 복잡한 얽힘을 전제,The study unravels the causal chain behind the collapse.,positive,moderate,deliberate,strongly descriptive,
C4-07,4,Analysis & Interpretation,unpack,unpacking,(의미·구조를) 풀어 설명하다,뭉뚱그려진 개념을 낱낱이 뜯어보다,X unpacks Y,unpack the concept / assumption / term,unravel보다 개념 분해에 초점,We unpack the assumptions embedded in this measure.,positive,moderate,deliberate,strongly descriptive,
C4-08,4,Analysis & Interpretation,distill,distilling,핵심을 추출하다,핵심만 걸러내 압축하다,X distills Y,distill the findings into / key insights / principles,summarize보다 정수 추출의 뉘앙스,The review distills a large literature into four propositions.,positive,moderate,deliberate,mildly descriptive,
C4-09,4,Analysis & Interpretation,interpret,interpreting,해석하다,의미를 읽어 내어 해석하다,X interprets Y,interpret the results / findings / evidence,explain보다 의미 부여에 초점,We interpret these results as evidence of crowding out.,neutral,moderate,deliberate,non-descriptive,
C4-10,4,Analysis & Interpretation,infer,inferring,추론하다,단서로부터 미루어 판단하다,X infers Y from Z,infer causality / intent / a relationship from,deduce보다 개연적 추론,One cannot infer causality from these correlations alone.,neutral,moderate,deliberate,non-descriptive,
C4-11,4,Analysis & Interpretation,deduce,deducing,연역하다,전제로부터 논리적으로 이끌어 내다,X deduces Y from Z,deduce a prediction / implication from,infer보다 연역적·필연적,From these axioms we deduce a testable prediction.,neutral,strong,deliberate,non-descriptive,
C4-12,4,Analysis & Interpretation,construe,construing,해석하다,특정한 뜻으로 받아들여 해석하다,X construes Y as Z,construe the provision as / narrowly / broadly,interpret보다 법률·규범적 해석,Courts have construed the provision narrowly.,neutral,moderate,deliberate,non-descriptive,
C4-13,4,Analysis & Interpretation,signify,signifying,의미하다,무엇을 뜻하다·나타내다,X signifies Y,signify a shift / departure / commitment,indicate보다 상징적 의미,The revision signifies a departure from earlier doctrine.,neutral,weak,accidental,non-descriptive,
C4-14,4,Analysis & Interpretation,decipher,deciphering,(난해한 것을) 해독하다,암호처럼 난해한 것을 판독해 내다,X deciphers Y,decipher a pattern / script / signal,interpret보다 해독의 난이도가 높음,Researchers deciphered the encoding used in the archive.,neutral,strong,deliberate,strongly descriptive,
C4-15,4,Analysis & Interpretation,translate (conceptual),translating,(개념을) 해석하여 옮기다,개념을 다른 틀로 옮겨 이해시키다,X translates Y into Z,translate theory into practice / findings into policy,interpret보다 다른 영역으로의 전환,The paper translates these findings into policy recommendations.,neutral,moderate,deliberate,mildly descriptive,
C4-16,4,Analysis & Interpretation,analyze,analyzing,분석하다,구성 요소로 나누어 체계적으로 살피다,X analyzes Y,analyze data / patterns / the structure,examine보다 방법론적 절차를 함축,We analyze panel data from thirty-two countries.,neutral,strong,deliberate,non-descriptive,
C4-17,4,Analysis & Interpretation,examine,examining,"조사하다, 검토하다",자세히 살펴 검토하다,X examines Y,examine the relationship / evidence / claim,analyze보다 넓고 덜 기술적,This chapter examines the relationship between the two.,neutral,moderate,deliberate,non-descriptive,
C4-18,4,Analysis & Interpretation,inspect,inspecting,면밀히 조사하다,결함을 찾기 위해 꼼꼼히 점검하다,X inspects Y,inspect the records / output / residuals,examine보다 점검·검사에 가까움,We inspected the residuals for signs of misspecification.,neutral,moderate,deliberate,mildly descriptive,
C4-19,4,Analysis & Interpretation,probe,probing,면밀히 탐색하다,깊이 파고들어 캐묻다,X probes Y,probe the mechanism / limits / assumptions,examine보다 탐색적이고 집요함,Follow-up interviews probed the limits of this account.,neutral,moderate,deliberate,strongly descriptive,
C4-20,4,Analysis & Interpretation,investigate,investigating,"조사하다, 연구하다",체계적으로 조사해 규명하다,X investigates Y,investigate the causes / effects / question,examine보다 조사 규모가 큼,We investigate the causes of persistent regional disparity.,neutral,strong,deliberate,non-descriptive,
